text,label
HOT ISIS SOCIAL MEDIA PHOTO Laughing Jihadis Get Baby To Kick Severed Head 8211 warning graphic lnyhbt tgdn,0
The Pirates have made the playoffs and the Yankees are outhell has frozen over,0
Yankees win Final score 74,0
mashed potatoes string beans yellow rice and chicken 128523,0
sexy lad with hot soles and arches,0
BREAKING Louisville coach Charlie Strong is expected to accept Texas job according to ESPN amp media reports 187,0
Flappy birds cheat codes,0
Jose Soto Reflections of a former gay teabagger,0
Yankees fans having flashbacks You remember THIS Phil Hughes Its already 4 to 0 still no 8230,0
I wept when ThurmanMunson died and I weep 35 years later Captain Yankees,0
Youre stuck on ghetto middle school days Step our g 8212 wtf how ah I stuck in the middle school games jusy bc,0
Welcome to the family Mia Meli new puppy adorable cute fluffy mutt mybaby girl,0
I never really rocked with the white sole I feel ya bro But these? My favorite Foam of all time,0
Peeps are trash Marsh mellows in general are trash,0
International law enforcement operation disrupts Shylock banking malware PCWorld International law enforcem,0
Lifelong Yankee fan puts aside rooting interest and returns lost Red Sox World Series ring to rightful owner,0
if McCoy wasnt trash thats a TD,0
You mean the one I colored with crayons isnt copacetic?,0
Russell Brand mocks Bill OReilly for proposing Berlin Wall against immigrants VIDEO,0
Bjergsen just made a full AS rune page I dont just me full AS reds and Quints I mean AS reds blues yellows and Quints 47 AS,0
Overdosing on heavy drugs doesnt sound bad tonight I do that pussy shit every day,0
Damn Charlie Wilson is still around?,0
French word for potato translates as earth apple Banana is long yellow tree apple Submarines are big wet hollow kaboom apple,0
Or dont vote for the cripple amirite? bigot MT Vote VoteWendyDavis for Governor of Texas,0
np Shy Glizzy Awwsome Remix Feat 2 Chainz amp AAP Rocky via,0
Finally Warner Bros making superhero films starring a woman person of color and actor who identifies as queer,0
1996 and 1999 World Series Rematch Yankees Braves,0
Leave it 2 teabaggers 2 whine about when they r the ones who wont pay for it Waiting on god to fix it? morningjoe,0
Dress shirt saggy jeans backwards Yankee hat now thats lifting swag,0
Munching on ww crackers amp studying NYCs trans syst Since NYC amp I havent had a thing in over 15 yrs clubinsomnia vacay,0
This cowboys an redskins game was a hell of a game,0
my score on flappy bird is higher than the broncos score right now,0
They didnt lose the city Red Sox fans are bandwagon fans just like Yankee fan morningjoe,0
Best of luck to Tino The Bambino Martinez in Miami your legacy is saved LOL Marlins Yankees RedSox MLB,0
a pissed lad past out I would lick his dirty soles while he slept,0
versace bird feeder,0
Virtually zero protections for LGBTQ persons in Alabama Not a lot of acceptance either Think about queer Alabamian kids today?,0
Frozen peas and ibuprofen My new best friends cripple,0
You men are trash if your homeboy is cheating and you dont tell his wifegirl and break up their family LOLNO,0
Jeter almost broke Yankee stadium,0
How now gungho?,0
I was accused of never taking a full front face shot so here is one No slant or angle or nothing,0
I wants to call bouts my vitaligro but I aint sho if you a doctor fo da colored folk,0
Gwen Stefanis new single is trash her hilary duff britney and fergie have to give it up and go raise your kids and judg8230,0
Who needs Twinkies? When you got Gansitos?,0
In DC Fri 13 Bengali Harlem readingconvo 14th St http8230,0
Their salsa negro is awesome,0
and I believe we all evolved or whatnot but I find it hard to believe that we all came from apes,0
I miss Twinkies and Susie Qs Tragic loss to society What is next? Pixie Turtles?,0
get some money and stop playing that old trash,0
like animal crackers are legit the best snack,0
man what about Wilson being the 2nd Black QB to win a chip? Talkn about trash talk No shine for Russell,0
Yeah I know its Jeffs book The one where he admits to beating prisoners and lying abo8230,0
vintage mickey 127800,0
Is dare any colored players in hockey?,0
Bout to make some brownies in a few,0
Boy went trick or treating at Charlie Sheens Dada not jealous cause all Charlie gave out was really good candy and by cand8230,0
Hold all your ghetto labeled and endorsed vodka brands you can rum me silly any day,0
Ill let u clam on top and let dat nookie pop Im in dat cookie jar I aint no rookie girllll,0
Or when youre in my neighborhood You know youre in the mexcian ghetto when,0
Hot 97 trash,0
Parque de atracciones abandonado en Jap243n,0
GUYS I just walked into an office and the secretary has a bird Looks like I may just find out for myself,0
Youve got to have smelt a lot of manure before you can sing like a hillbilly HankWilliams,0
This Isnt Murica Charlie Brown rejectedpeanutsspecials,0
Perhaps Ezra Miller is the first crack toward changing that regardless of whether he identifies as queer over gay,0
DOMINIQUE Made Larry bird do a 360 lmaooo,0
we gunna laff at ChavaRubio beaner supporters in a min,0
declares victory by introducing our next governor Charlie Baker wcvb,0
Im Camera Shy Dont Talk on Phones and Love when it rainIf youn kno the life you wouldnt understand,0
Oh but those last few that did Charlie Wilma Jeanne,0
you should make me brownies,0
This no beef thing is for the birds,0
TBT love you forever ling ling 128115128114128152,0
Bae means Before Anyone Else Ive been here thinking its a ghetto word for babebaby,0
i still live with hope that one day a hot rich boy will fall in love with me even though im trash,0
I hate when females try to sound like bird heads,0
Keys open doors when them keys is albino,0
Man in zebra print dress robs bank,0
The Office fuzzy socks and my favorite blanket is literally all I need in life rn,0
Flappy bird is dusty,0
When Americans claim ISIS is just a local threat reply You mean just to Iraq Syria Turkey Jordan Saudi Arabia Leb8230,0
I pictured Angus running up the side of FOB Sharana with every day in Afghanistan,0
mt commission gouache tiki wahine monkey tubed surfing wavesliding waterwalker notkook,0
If you dont like my tweets with my belief in Jesus Christ please respect it but dont mock it or make negative remarks8230,0
WTMF is Murica? You say it you should be in the throat or sole stomped,0
Forget your typical graduation speech Charlie Day manages to be hilarious AND inspirational in today8217s MIFVOTD,0
8220 An itsy bitsy teeny weeny yellow pockadot bikini8221 Polk Ashton Polk,0
If you a hoe ima treat you like one just like if youre a good girl ima treat you like one I dont,0
ATL BVB SWS PTV THE RELAPSE SYMPHONY SET IT OFF FAREWELL MY LOVE MAYDAY PARADE FOB PARAMORE etc,0
Now the Jihadi networks waking up amp claiming Raqqa radio two planes shot down amp 1 pilot captured ISIS Syria,0
Ill trade you one car drift for brownies,0
Charlie Crist says OCare has been great? ccot tcot teaparty PJNET Independents htt8230,0
Lmao the shovel video is pretty awesome she went down like a ton of bricks lol Gotta love honky riff raff savages That is all,0
Lol shut up lmao early bird gets the worm,0
International law enforcement operation disrupts Shylock banking malware PCWorld International law enforcem,0
Dat was Charlie,0
Early worm gets the bird Bslfe GoodMorning,0
8220 Tom Brady slowly becoming washed?1280648221 Nah His weapons just trash,0
After seeing Kansas play Duke a couple weeks ago I could tell you Im surprised that Charlie Weis has been let gobut Im not,0
Oscar Taveras went yardie in his 2nd career MLB at bat What a stud,0
Stephan A Smith saying Jay Cutlers shouldnt be a MVP candidate is just straight up retarded,0
So this is the woman who was a bird then turned into a woman from the sky in Nigeria,0
Just hit 40 in flappy bird128527,0
Well done to who correctly answered Almeria 26 yellow and 1 red card so far this season,0
I got a uncle through marriage dude got hips like big momma I swear all the lil kids mock his walk and he dont even know it,0
but is not even a blogger He doesnt have the moxy or credentials to do anything by himself and create a brand,0
8220 Tag a friend that sucks at flappy bird8221,0
wth is that playing missy? i mean seriously? This movie gone be trash,0
Charlie and I love that dog,0
Supporters of officer Darren Wilson rally in St Louis ferguson kkk tcot tpot teabaggers teaparty,0
Marshall Law Whatever you coon,0
PS3 and case is still in the trash can idgaf anymore,0
lax gun laws? Ur retarded Theres murder there bcuz no one can defend themselves Only crooks have guns there,0
And I thought I had a problem Oreos,0
because their parental unit is trash,0
Thanks Charlie have a great evening,0
I mean most ppl confuse when to use to and too this nicca used the word two when he shouldve used to 128530,0
with Louisville 5 losing last night a win to iubb 7 tonight should have them back in the top 5 ncaa basketball iu hoosiers,0
Did you say spray tan? Charlie Crist switches back to Republican,0
Scores dont matter in Spring Training man,0
5 of us decided to drink Everclear and go to a Yankees game Only two made it to their seat,0
Oh its Saturday funny time You better redneck necognize,0
Or get swept in MoTown LOL Yankees Tigers MLB,0
Have you noticed all the ghetto people naming their kids after cars? Mercedes8230 Lexus8230 Repossessed,0
Get me a bag of those pink n white coloured van sweets please Thanks dude,0
I much prefer this classic blue and yellow Rams uniform to anything weve seen since that magical year Not even close st8230,0
CAIR Publishes a Hit List for Jihadis via If you are a red blooded American you may be on the list,0
How the hell was David Murphys hit not a home run? Clearly over the yellow line another umpire mess up Smh,0
The Giants trash,0
There hasnt been a trade this lopsided since Babe Ruth was traded to the Yankees for No No Nanette cash,0
Noap Not taking them Maca root pills making my vagina do the wop,0
Whoever made these brownies and cookies belongs in heaven,0
Bet Charlie Strong has contacted Ridley,0
pang POW HOW U LIKE ME NOW Shouts out 2 my bro Dre Hogg Style Ent Uza fool 4 dis 1,0
goh d AnoniemeAso meeting heeft weer pauzeNog steeds niet bij hoofdstukhoe haal ik mn ID?,0
8220 Car hopping is a different world these ghetto guys tried asking for my number LOL8221 did they have to be ghetto Tho ?,0
cookies and crackers arent even on the same level,0
8220 Oreos And Milk 1285238221,0
If the get Dempster they just look like theyre getting older smh Bring some youth mlb,0
trash cans are always demanding new music from the gawd Tyga,0
that pointy nail game is for da birds,0
nips,0
Literally just got up and the first thing I did was chug a huge glass of water,0
Whipped,0
yellow in paris Fantastic effort from AllezWiggo and VroomFroomenow just the last stage up for grabs GoCav TDF12,0
you mean trash,0
Im Pregnant Charlie Brown WorstPeanutsSpecialEver,0
Playing a show in Lutsen MN at 900 PM today at Papa Charlies,0
Heres your first look at Charlie Cox as Matt Murdock in Marvels on Netflix NYCC,0
or if we pick you up in SC and take you with us nip to CR,0
Whoo? A new attraction in Virginia City birds of prey Meet this owl famous for his role in Harry Potter,0
Laat Zihni Ozdil met rust jullie gemene trollen hoe durven jullie zijn mening in twijfel te nemen Zijn zegje is wet enkuchkuch water,0
I love the acoustic domes in the hallways Favorite place to sing in public No lie,0
Apologies trash Whats understood aint gotta be explained,0
Note the rocketeer removes cardboard from launcher and carries it to a trash bin before fleeing TidyTerrorist,0
Lets go hoosiers iubb 127936,0
go away already,0
I still cant understand why we dont dump our trash in the ocean its pretty big and itd surely be cheaper than launching it into space,0
this the I play soccer cheat on girls and wear khaki coloured cargos haircut,0
Twitters little blue birds name is Larry after Celtics ISU Larry Bird stick ticker is TWTR,0
not scanger,0
basic trash,0
Shy Glizzy Decent Af,0
128073 128072 Tiny Jihadi,0
You wanna find hoes on here? Just follow the chicks who reply with heart eyes under sex gifs,0
Wow redskins dont want this,0
any more birds in school?,0
Smuggled letter by Gaza tunnel digger details suffering under Hamas rule via,0
PHILOSOPHY EXISTENTIALISM AND DEPTH and not trash pop MTVHottestLanaDelRey,0
Great GIF Got a source URL for ?,0
Mint Oreos gtgtgt,0
Everywhere you look all you see is hillbilly deluxe Big timin in a small town smalltownproblems neversaiditwasabadthing brooksndunn,0
eharmony just informed me that my soulmate is an 02 Sea Doo with a trash bag of Whataburger taquitos bungeed on top Thx Dr Neil Warren,0
This flappy bird game addicting,0
I held you like a baby bird 128546 and now you come at me like this These friends aint loyal,0
WTF Imma do about my legs Charlie Murphy,0
To call Martin baker an Uncle Tom and uppity because hes not siding with the majority pure ignorance,0
Who wanna play pin da tail on da colored mans butt?,0
Maybe I dont feel too great because I only got 3hrs of sleep Surely its not last nights boxes of cookies amp crackers dinner 128055 128534 chunk,0
hopefully not back in da ghetto?,0
Starts making monkey faces behind you,0
Really? This is whats concerning him right now? MT Looking forwd to speaking with John Kerry tomorrow AM abo8230,0
and another one 8220 Two hoes? yall know what we are? 128514128514,0
I don8217t talk trash regarding sports,0
IU should make me an honorary student id be way cooler than the other international students i have my own football card hoosiers,0
Looking at the Royals and wondering what could have been if we didnt decimate the Yankee farm system,0
Dont get me wrong G Id hunt birds but thats a lot of work amp well I just aint that hungry,0
Damn it be cold fo a colored man,0
Peace my friendOnly PeaceI am not your enemyDont say that word againLook at my Facebook wallOne of my best friends ever was a Moor,0
Wow and we thought we were the only ones with a luxurious interior OreoLove StufOfLegend,0
I nicknamed Lux Coach K because without him we would of never heard of Duke lol Charlie,0
nigor??,0
theyre not playing Charlie Strongs soft dont run up the score mentality Theyre playing this guy,0
i think i need to watch dawn of the planet of the apes now,0
tbt when i took my likkle monkey jimmys,0
Lou Gehrig had 17 hand fractures in his career Played in 2130 straight games IronHorse Yankees,0
The Shocking True Stories Behind Your Favorite Classic Fairy Tales via,0
when I die on flappy bird,0
All these afternoon groups are trash besides the Bubba Keegs and Furyk group,0
I really want a sports star to get a pet monkey and name him Achilles,0
Yankees like Florida State not Floridians,0
My nephew albino albinos have astigmatisms eye spasms partial blindness its not their faults,0
hate to sound all PETA callous and allbut buffalo had it a LOT WORSE than the injuns,0
how do people not realize the jig ?,0
im viswa moulie I wanna be ur friend Please shall i ?,0
To help eliminate faking injury amp diving post game video review of dives amp give divers yellow cards after game Wor8230,0
Burnating all Yankees and their thatch roof cottages Astros,0
ghetto gold needa be the first music vid,0
The people of the ghetto are rising up and fighting back Whose side are you on? Gaza,0
Its ok to trash talkbut I havent seen any Bama fans wishing harm or injury towards LSU players,0
when people say coloured,0
Dont you have a trash can?,0
now jimmy want to talk trash wouldve shouldve couldve now Chris stop talking and spitting,0
An ad for the Haitian charity Water Is Life mocks people who use FirstWorldProblems hashtag through juxtaposition,0
Hoi fai moke hau,0
what got me into baseball Well only a couple more days till all these legends will be retired CORE4 Yankees,0
just found out has an Australian president hoosiers are my team hoosierstate indiana iu iubb big10 202 tonight,0
I mean sometimes eating a carton of Double Stuf Oreos is your only option,0
I want my poms back lmfao,0
Now infuriated Jihadis are putting out murder requests on Saudi fighter pilots who participated in the bombings in Syria ISIS,0
Indiana lost to Bowling Green Big Ten continues to be trash,0
My favorite episode of Friends is the one where blacks mysteriously vanish and unemployed white people find affordable ho8230,0
Jihadis seem to be more upset over the location of the Jedah conference in Saudi than its purpose ISIS,0
I miss you Eating as we speak I miss you red bone and that cooking,0
foxnews cuts away when a Democrat talks and claim to be fair and balanced LMAO network full of teabaggers and liars,0
Someone tell his dreads are part of the uniform Id pull your hair too Why are you trash talking? Cut your Doodoo braids,0
Humans are genetically closer to chimps than chimps are to gorillas But we are all apes Have a great day you clever twe8230,0
Arent they the best? There story is here Now its time to visit our yellow friends at,0
I never did those games but I was obsessed with Angry birds Which is why it took me so long to do CCS I was scared Lol,0
The best way to make a hillbilly do something is to tell him he cant do it,0
The Bucs has 2 great uniforms and ruined them both for that trash smh,0
in fact were I to start a forprofit university this would be the sole requirement for graduation,0
Thou shall not mock Ryanthe futureKelly,0
Just spoke w legend mentor Charlie Ericksen Great to catch up w those who helped open doors for Latino journos thankful,0
8220 Everybody thats still on Facebook ghetto or pregnant idc8221accurate,0
Why are people saying dont let guys treat you like a yellow starburst? Thats my favorite,0
Why Tori Amos matters now more than ever via,0
I likes da Yankees,0
Debating feminism with a gay professor uninformed girls and low IQ rednecks is not my idea of a fun Wednesday night,0
OH NO are you saying the Democrats lost the teabagger vote? LMAO bobble head morningjoe,0
Me too 8220 Defiantly going to see that new planet of the apes tonight8221,0
Out of day care Im taking a kitty nap on you hosers,0
Just 113 days until Yankees pitchers and catchers report,0
Jihadis claim to have shot an Iraq army Mi35 attack helicopter in Beji amp identify its pilot by name rank,0
Top tip of the day if you want to be at an Elbow gig dont wear a yellow jacket,0
Yankees Damn Well Joe that move to the bullpen really helped,0
Overripe eggplants are not good eats UNCLEtweet,0
I went outside and got mad bc this weather is trash,0
Call me old fashioned but Im sewn together with magic and birds,0
Dude remember this wop video? OMG WHERE DID YOU FIND THAT,0
8220 Me when somebody says Childish Gambino is trash,0
8220 Oxtails and yellow rice is blasphemy8221 boneless,0
I bet shes a New York Yankee prog8230,0
I want some clams on the half shell,0
No more speculation No more mock drafts Its finally Draft Day BortlesKombat StormWarning BuiltByUCF ChargeOn,0
I am a thrill billywith a hillbilly heart HAHAHAHAHA Jesus Murphy,0
tikiti rough mock for the base of what will eventually be an ashtray Tiki Ti,0
their tortillas are trash though,0
To be clear I dont think theres any chance Krug leaves for Russia But its fun to mock the,0
that funky monkey,0
15 sad TV character deaths were still bitter over stark was the man,0
But only BBC the American version is trash,0
colored contacts,0
Charlie looking like hes the one that made that 3,0
And where do you think unsold items from thrift stores go? The garbage Think of all the great games that are in trash dumps as we speak,0
Whenever I see a pic captioned Soft ghetto I log off for 25 minutes,0
Perfect stock photography for an article about not letting a handyman get into your liquor cabinet,0
3D bird amp feather drawing,0
They took it there bro you know Im civil wait a minute Lol Dont get ghetto V,0
Turn on the magic of colored light longexposure lightwriting,0
Log off nigger relationshipgoals,0
Derek Jeter A class act A great Yankee A 1st ballot Hall of Fame inductee to be,0
Igot to level 21 so far on flappy birds smh,0
Trailor trash tina time 128556,0
Video Charlie Baker campaign team denies contacting Gov Patrick for meeting,0
trash smh game rigged bumgarner took roids,0
EXPOSED Jihadi kidnap and murder handbook and plan to infiltrate British Army and police via,0
Salute to Derek jetter Best Yankee ever,0
Every character on Thesimpsons is trash And theyre trash on purpose If you dont get that you dont get the joke,0
BWAHAAAA I just choked on an Oreo cookie IM figuring this may have something to do with it,0
Game 128 Preview Houston Astros at New York Yankees,0
If the crust ain8217t graham cracker keep that pie,0
one of my cats killed a baby bird and a cardinal,0
Thanks for coming with me last night because its ghetto and no one else could of handled it Summer2014,0
This is better than flappy bird128525128525 FallOutBird,0
Time for Ranger scouts to head out and watch some Yankee prospects rangers,0
there isnt a green one either Theres red and yellow in that pic,0
All I did was said her weed was trash,0
Aye a nicca is tired tho,0
8220 Anything below a A and we disown you ling ling,0
One mans trash is anothers Transformer 8594,0
Manual labor so trash,0
we found your brother Charlie out working on the dishes today DSN50 NASAsocial,0
Oreos and coffee for brunch I do what I want,0
Significant number of US tweets were Americans flipping the bird to IS UK not so much,0
Mommy said no pussy cats inside my dawgs house,0
Today did my hair and makeup He always tries to make me look like a monkey,0
Oreo milkshakes will forever remind me of,0
The boy who shot albino deer,0
People who slam on the brakes at yellow lights should not be allowed to drive,0
Charlie Sheens Video Message to President Obama,0
Id kill to meet Charlie Sheen,0
Amen on this tweet 105 mm rockets from Victor Charlie leave a lasting impression,0
TRUTH David is the Charlie Brown of Scandal,0
Yee boy my yung nicca told me dat waxx,0
Got damn the Lakers trash,0
this guy wears the WV yellow Rick James on his face,0
Free bird,0
itni bahaduri interviews mein to hamesha marne ko tayyar rehte ho got scared of crackers? LOL,0
9733 BEST ASIAN MASSAGE ON THE park slope TOP RATED SPA 9733 7186220221 24,0
New with Jinxy broadcast from the moon its made of chunky blue cheese you know,0
Literally in the middle of the ghetto and these people look scary,0
why were there penguins and a bird in the puppy bowl???,0
this is gobbledy gook to me because i dont have the game,0
oh my phone is some trash but you knew that,0
Quick game for Sox Yankshope you get home soon,0
oh state just enjoy your trailer trash and your sub par sports,0
really? are my nudes trash?,0
worse yet u meet a bird with a nice ras and youre like something about u looks familiar lol8230,0
Im getting trash talked by a 8 year old wtf,0
ima fill ur clam out,0
Lmaoo we was sayin this same statement last year Boozer is trash bro Im done 128514,0
Thank you Charlie,0
10 15 On average 2 But I can be an 8 when need be On a scale of 110 how ghetto are u?,0
on the first day of school my backpack had no paper and no books all it had were 4 granola bars a brownie and a bag of cookies,0
mock draft?,0
Rotherdam RapeJihad coverup young girls sacrificed on altar of political correctness in favor pf paki pedo gangs,0
This one night I was tripping off brownies I put my running shoes on and I was still in pjs it was 2am,0
thats not ghetto Thats sweet and a movie quote Try again,0
No prob Def a good early set energy tool If you want to tune in in less than an ho8230,0
Week from Thursday might be the last Yankees game to look forward to in a while If nothing else Jeter deserves that night 8230,0
Being coons 8220 At??? Yall are amazing8221,0
Wow he basically just told his daughter I want some mocha colored grandbabies HTGAWM,0
Uh oh California solar plant fries thousands of birds in midflight Hot Air,0
Yep sources confirmed it That Iggy concert last night was trash,0
ughand lemme guess they have yellow cake too? Heard this story before,0
God is a Yankees fan FarewellCaptain,0
Are you sure about that slant? Theyre and you have no idea who I am,0
also Nack which autocorrect changed so Im putting my phone in the trash and going to sleep,0
Trending 2 adult human skulls found in trash in Connecticut,0
Charlie Daniels couldve done a better job MNF,0
The jigg is up,0
Is it just me or is Hicks saying bung beds?,0
Im referring to the second down put Vick in slot play trash,0
Theres coon classic R Kelly Usher and then theres classic Stevie Wonder Prince Not that theres anything wrong with8230,0
walking dead gonna be so trash this season,0
GA Charlie,0
you gotta be like me n the twins just chug it all before everyone,0
Woot Yankees completed their sixth series sweep of the season and fourth at home,0
Killer line? Josh Smith dropped a killer trash talk line on Kenneth,0
time to dump another diet coke in the trash,0
ELECT Democratic Nominee Charlie Brown for Gov of TN DEFEAT R Gov Bill Haslam,0
Not taking Franks advice and he ate the yellow snow,0
Im guessing so The players are talking trash,0
A teen was running around Target in monkey pjs screaming OO OO AH AH amp the fitting room girls were cackling Was today designed to annoy me?,0
Hes an idiot miserable trash excuse for a man,0
When I make the paper ball into the trash can,0
I was impressed that anybody could chug a Smirnoff Ice that quickly,0
Jindal seemed to be having an outofbody experience enhanced by special brownies Bj Up and At Em stribpol mngop,0
in that picture yes I havent had an updated pic added the angel wing is colored now too and thanks represents what I am,0
Cant beat a score of 12 on flappy bird givingup,0
aye I respect ya hustle and all but dont tweet me anymore trash ass videosthank u kindly,0
Atlanta Houston has so many trash drivers,0
Im a sucker for colored eyes 128532128532,0
