text,label
This is a sexy tweet With a 60 lead Yankees turn to Matt Thornton to finish off the Red Sox in the 9th,0
Your mother looks like a birdI see where you got 12 of that from Nice food too,0
Bruh soo trash,0
Who wants to get there nose in these bad bois then scally chav sockfetish stinking hot sox and legs,0
Just killed 3 birds with 1 stone Thank God I payed attention in my communication classes work,0
I dont always get drunk and pass out but when I do when did they start making colored duct tape?,0
A random am scroll lands me here Charlie horses durin sex just simply means you didnt drink enough water that day,0
Theres nothing hotter than a pale albino chick who can play guitar,0
Nipple banana monkey,0
I find it amusing that Senator is an anchor baby LMAO,0
I like where ur domes at smart,0
IU 8 straight nation college soccer champions Wow hoosiernation hoosiers 9917127942,0
Hi Charlie eating leftover candy?,0
them jants be clutch for bedtime tho 128514128557,0
youre not ghetto tho You can live in the hood and not be ghetto facts,0
8220 Kanye West is a costume not a mock of a race8221 girl I hate to do this but Kanye is a human not a costume but8230,0
Rather than believe that there was a man who was the very definition of good u mock it,0
Mace For Your Wife Charlie Brown? rejectedpeanutsspecials,0
Thanks to cracker tweets today my pilchards on Krackerwheat are repeating on me like a typical night on the BBC,0
Absolutely absurd that they even had to think about that call joke zebras,0
I know thats trash,0
If NBC has elected you to be a spokesman for NBC they are in a lot of trouble I and friends will no longer watch NBC trash 1,0
White people need those weapons to defend themselves from the subhuman trash your sort unleashes on us,0
that movie was trash,0
Facebook is for the birdsIm over it,0
now time to find the monkey term scripts,0
I want a pet monkey 128553128525,0
some Mets fan tried telling me Rivera isnt of the best Yankees of all time because he is just a closer WTF,0
Maybe Baylee Ann Tater Pud Nurse Fester Charlie Chainsaws amp Mama Rot should be their own team? Next time in,0
woof woof and hot soles,0
Get this monkey off my back,0
you and me having Twitter bird shaped pancakes that would just be a start,0
So I can get into something closely approximating the full bird of paradise yoga pose TIME TO MAKE MY RAGDOLL COSPLAY,0
Also as part of my release day gift yes we get those this adorable bumblebee bear Montlake,0
called Charlie Baker to concede around 815 this morning She plans to address supporters at 11am wcvb,0
8220 i need more beanies8221just ordered two true religion ones lol,0
Whipped cream 98299829 endlesslove,0
Protest climate change leaves trash behind VotingMatters,0
If I had a dollar for every time I died on flappy bird,0
These are insane and Cigars trash? Foam done bumped his head These are insane Like so insane,0
Explains why theyre waving trash bags around over their heads,0
I forgot youre the same bull that said Yeezus was good and that JCole is trash,0
No one has even eaten a Twinkie in like decades,0
he will need monkey bars on his tricycle,0
Take me for a ride 128525128139 woof woof,0
no its yellow fin Its in edgewater,0
A portable septic tank For allllll those pesky feelings,0
Illadvised slant call there,0
Adam West? LMAO this is trash b,0
Whoever mocks the poor insults his Maker he who is glad at calamity will not go unpunished,0
A white lighter is bad luck not yellow ur stupid,0
Oreo Ice Cream Cake,0
Good read gt Why your cat thinks youre a huge unpredictable ape,0
Have their been any reports of an aerosolized virus that turns apes intelligent? Seems like that kind of day,0
Sweet baby birds you crack me up Houston Foodlovers,0
Do you have a nickname? What is it? 8212 Tator Tator tot Tightey whitey whitey Jr Taylor whitey pants agent ti,0
8220 In the fashion world urban means stolen from black people its ghetto on us and urban on them haha 128588,0
A shockingly true tale from the Oreo that almost got devoured,0
Libs trash Saira Blair an 18yearold Republican who won a seat in the West Virginia legislature,0
I seeing ppl saying running a train on a bird and a parry is the same thing but das not what I knowso looking for clarity,0
yellow bone be oh so easy wit da name callin b,0
Im telling you man Roethlisberger got his record expunged and became trash,0
Me gusta pollo so espa241ol that Lol 127831,0
I want a cowboy killer,0
Goodbye x Young Dolph featuring Trinidad James amp Shy Glizzy,0
Me Do you sell any larger sized condoms? Her Sir those are 13 gallon trash bags Me winks until security escorts me 8230,0
The guinea fowls are not what they seem,0
I cant stand to be around ghetto girls128134,0
Who remembers when we were in middle schoolhigh school and would throw paper in the trash from our seat and yell KOBE Lmfaoooo,0
Oreos are my life,0
193lbum de fotos csitaly TS3Fairy Tail Satan Soul Mirajane Strauss made with The Sims 3 Happy,0
CommonQuestionIGet Why uou so ghetto?,0
Yankees great Joe DiMaggio reportedly used to beat wife Marilyn Monroe Here she is in 1954 announcing divorce,0
I assume so the tranny went out this morning I have a maxima,0
8220 Yankees Michael Pineda in his next start,0
Id rather hear Neal DeGrasse Tyson tell me about scientific mistakes in their assumptions than some WASP,0
When you try to tell grandpa that 70s music was trash,0
Yep sobs I got my hopes up when a couple of the national guys including that KiperMcShay mock had him slipping,0
Uturns on yellow 161NO ACEPTAR ESTE LUZ ROJO 9835 Lights taking too long make me bilingual 9835,0
9733 BEST ASIAN MASSAGE ON THE park slope TOP RATED SPA 9733 7186220221 24,0
Well we sure as heck know how to read Im reading the trash right now and almost Ive heard on the web8230,0
Should I be worried that a lady behind my building is talking to a crow?,0
484192841908419 moke up,0
after 4 hours and almost 8 pages i want to slit my wrists but i guess ill just settle for sleep,0
Yankees Damn you DirectTv blackout the Yankee game With a freaking WALK OFF Youre killing me satellite douche,0
the little girl Tom Sawyer gets trapped in the cave along with Injun Joe and almost die injun Joe dies and they find his treasure,0
Phil Hughes looking like the Phil Hughes of old 2010 Yankees MLB,0
LikeCharlie Chanstyle? Never saw that either Hmmmakes me think of the Cockneys in the Killzone series,0
sings Careless Whisper to broken 7 year old flip flop on the way to the trash,0
Endless but they really trash so none Men how many positives and possibles do yall have on fri thru sun night?,0
NEVERMIND I FOUND THEM in the trash,0
copy my tweet again you ginzo,0
I eat dat chicken out your love box baby Lovin a white woman while eatin chicken A colored mans dream,0
Khloees new backpack that we colored last night 127912,0
Fine chicks lap dances always trash,0
They have to That division is trash Saints gon win the NFC Southwatch,0
momma said no pussy cats inside my doghouse,0
somebody take these Oreos away from me before I eat the whole pack,0
Im not a liberal amp I support changing the name It transcends standard political grandstanding,0
I didnt mock anything Was asked I believed in Noahs arc and said no how is that mocking any religion? Opinion thats all,0
Here come wiggas soft tweets 128514,0
Yall know Skip Bayless is about to slit his wrists over Romo Lol,0
Lol Have fun 128516 I havent been to a race since HS Charlotte Crazy redneck times Lol,0
lil spook and yung lean and robb all night,0
hoosier fans is cody zeller nominating for this years NBA draft? iubb,0
Finally got my medicine and crackers,0
Finished Yankeeography and still hate the Arizona Dbacks for winning in 2001 Yankees shoulda had that,0
we in this bitch finna get crunk eyebrows on double PAPP 128165128165,0
and a prime Leija would trash most of these 140 dudes today,0
Stafford trash without Megatron fantasyfootballproblems,0
I was already 24 when Jeter arrived so I had plenty of Yankees memories but next year is going to be very odd indeed,0
8220 Where do all the foreskins go when they circumcise a guy?8221 the Foreskin Fairy takes them after you put them under your pillow,0
lol then they have one more flavor I think its yellow idk But yea there bomb,0
Jihadi streams British ISIS fighter identified as Abu Abdurahman Al Britani killed in action,0
What I really want is some brownies from HampR iced latte my boy and a blanket w movies That sounds prettttttty amazi8230,0
I think Zlatan even has Class in the way he talks trash,0
As soon as a Democrat gets a chance to ? the political hack foxnews goes to commercial then back with Bolton LMAO teabaggers benghazi,0
Dad brought me home a watermelon eegee but I dont like it so its going in the trash 128686,0
I would bitch about the weather being bipolar but Im just gonna appreciate how nice it is instead,0
I want a four loco right now so I can chug it and go straight to sleep,0
okay cool then Im not the only one 128520 mine is black and fuzzy and it has PINK on the back in all sparkles 128081,0
Giants vs stinky birds Sunday think Ima make some wings 128522,0
If youre not directly descended from European royalty and upper nobility then youre not fully human Youre just common gutter trash,0
Rihanna really is trash,0
a video an entire media will likely mock i am such a crybaby,0
trash,0
Please stay safe you guys I love you so much I hoe to one day meet you guys happy,0
I went to college Every college got a bird class where u can get ya friend to sign u in amp get an A out the class Rashad 8230,0
third party keyboards on iOS 8 trash,0
SOMEBODY please BRING OUT OF MY hotel room and HIRE ME for something REALgt I work hard for somebody throwing me in the trash IWantOut,0
lol true I just want fried Oreos,0
These brownies,0
Anyone want some absolutely amazing and deliciously fresh perfect monkey bread? 128586128584,0
Apolonia Gardner of Imperial CA misspells phalarope a bird that resembles a sandpiper The dreaded schwa spellingbee,0
People who dont put their blinkers on seriously just need to crash into a pole or something 128548,0
They got the redskins faking injuries,0
shes browasken because ssidehe belihoeved,0
Yaoooooooo Mawnin yardies 128154128155128536,0
Beautiful Fairy Elegant Dress,0
Fresh out the gym but yet Im bout to eat free birds,0
Yankees can jump into first place TONIGHT if you think they will,0
My best friend says I dont need to be in love right now he thinks its too soon to love monkey,0
Charlie Crist Losing 50000 Florida Jobs To Raise Minimum Wage Is 8216Worth It8217 Conservative Byte via,0
Okay okay but Trans birds,0
wiz khalifass song black and yellow is a beautiful song about a bruised banana,0
Enjoying My bed Just perfect For me My Teddy bear and monkey It Singlelife bed teddybear,0
Eating a roasted potato and smiling till my cheeks are sore the crow SFX in this Cape Crisis are supergreat,0
So this ape can get a MCM but I cant unbelievable,0
Nope got lucky some washing on the slopes gonna make it a little rough combining but feeling very fortunate today,0
Nope never taken actual stuff Just wifi Acct info in their trash cans at 3am Super easy,0
Because Outman is a brandnew Yankees and because Girardi will never use 3 relievers when he can use 6,0
RAWR My sexy French scally I love him frenchscally sexy scally woof woof,0
Figure all da ofay like to see my family pitcher,0
also I put i touch myself on a nedchuck mix,0
im so sick of self serving politicians standing by while BO trashes America WeAreRepublicNotRegime ImpeachObama,0
how much you wanna bet that a antigovernment black helicopter teabagger was behind the Boston Marathon explosions? p2 tcot,0
Magellan? You suck at trash talk,0
Chance is trash,0
this the I play soccer cheat on girls and wear khaki coloured cargos haircut,0
What did I prove for you? That youre blissfully ignorant? Group thinker? Political chump and race traitor?,0
its kinda screwed up that they were my guinea pigs but i was only experimenting on taste instead i got more interesting results,0
even nature looks awesome when colored in 663399Becca,0
I also had a dream that I went to the FOB show and FOB was rude to me and was getting badly hit on by some creep,0
Them hoes are clean,0
If Ashton is trash then what does that make me Come on guys someone like Ashton cant be trash he makes too many people smile,0
8220Not all men interrupt women to quibble over irrelevant issues for the sole purpose of derailing a conversation8221 he sa8230,0
Yu hoes just love to pump fake bout yall lives on these social networks,0
Gotta love the undignified sprint across the yellow light to transfer buses because the first one was dawdling,0
Calling out teabaggers conservatives on their BS via,0
Yeah one called me a race traitor lol,0
Sweet treat at lunch today raspberry gelato ginjuice sorbet amp brownie gelato GelatoCart Thursday cant wait,0
How is Angry Birds the movie going to work? Theyre just floating bird heads?,0
lmaoo abo crusty hands,0
Tracy Morgans car wreck and the press was covered by Zappa in the 60sSome joker with a brownie and yell see it all complete,0
Obama killed the Twinkie gonetofar,0
how are you Argie?,0
Flappy bird stresses me out,0
I need a cowboy killer and a cold one about now probably too tired tho to get down128541,0
Gone bust it open for a real nicca 128540128540,0
Big bird holds press conf claims he does not care for the letter f,0
I saw the actual tweet while scanning Jihadi accounts They put a screen shot of it with all aid workers r spies,0
Damn I think your redskins lost,0
Colombia supporter reminds us the double bird is a universal language,0
Taco Bell is super trash when youre sober,0
thank you again mick,0
let me guess they have yellow cake too? Same crap different president,0
the only boards I still have from them are just the tie dye ones monkey edition black and silver and the newest ones,0
you make me feel all warm and fuzzy inside 128522 youCANsitwithus,0
First jig of the night,0
well thats some cracker jack secret service work there jfk anyone?,0
Yankees playing tonight in the Bronx3rd game of the current series against the diamondbacks,0
Lets just say the hotel Ive been staying at isnt going to want this hand towel back I had no idea I could turn em that shade of yellow,0
Only Americans are degenerate enough to honor their war dead by having a barbecue Anyone who grills out for Memorial Day is trash,0
Its a birdIts a planeIts SuperManu NBASuperHeroes,0
New show announced in Lutsen MN at Papa Charlies on January 29 2011,0
Big night of 127936 hoosiers iubb big10 and pacers nba indiana hoosierstate paulgeorge codyzeller,0
Im confused Martins Indi just drew a yellow card but I didnt see him steal a tank from the Brazilian army and open fire 8230,0
WashPost Describes Charlie Crists Bizarre Obsession With Fan Between Legs To Stop Sweat When AskedAnswering Questions DoG,0
Re Alexander Skarsgard my roommate has declared Hes a sexy albino lizard i dont know how thats sexy but it kinda is,0
A day without laughter is a day wasted Charlie Chaplin,0
The new nature area replacing Indian Boundary Parks former zoo is expected to attract a variety of migratory birds,0
Iraq gov troops were handed a severe defeat by ISIS at Saqlawiya theres chatter of over 300 soldiers lost amp Jihadis raving about it,0
woahh Ahha I remember her from Charlie and the Chocolate Factory Who do you think killed Lucy? I think it was Abby,0
Jets Bills and Dolphins all win How does sole possession of last place feel Mr Belichick?,0
Altyd zo geweest hoe vaak men ook zegtdit nooit vertonen z dierngedrag,0
IF A SINGLE WASP COULD READ THESE WaspFacts TWEETS THERE COULD BE A PEACE TREATY BETWEEN WASPS AND MAN BUT WASPS ARE 8230,0
128525128525128525 8220 i guess ill just trash this drawing because of roster changes128532,0
I want a slope job so I can get away from and be by myself for two weeks I hate being around people unless they are my friends,0
sheeze a yellow bone,0
Going up to the view point and seeing star child What the monkey,0
mk Hun just textith me,0
I would describe s work as blaxican,0
We actin like its the 7th day 128123spook,0
I dont own any Onslaught on Vinyl I may have to get one now Their new Lp is available in army green coloured vinyl,0
naah da twitter bird 128542,0
anybody remember that movie Thumbelina? I didnt noticed how flamin the bird was until now,0
in the trash i hope just dropped four new songs,0
ltltltwhen its yellow outside,0
Pepe because his defending was outstanding His tackles were accurate nd he did hos job perfectly in both legs,0
Looking back I liked colored better Lets go back to that,0
In their primes MJ would have dominated LBJ in 1 on 1 Just so much mentally tougher MJs trash talk alone would unn8230,0
the worst terrorists are republican teabaggers,0
I like how I found out that you can now edit Facebook comments through a trending topic on Twitter You think Id hear abo,0
Jihadis Turn Washington National Cathedral Into Mosque For Friday Prayers lnyhbt ccot teaparty gop tgdn,0
This Charlie Murder game is pretty dope Xbla,0
Time to start listing to il spook,0
Proverbs 126 I also will laugh at your calamity I will mock when your fear cometh,0
Its unattractive when girls act ghetto,0
So you dont want to see the true life story of American heroes Bizzy Lazy Krayzie amp Wish you wanna watch shoot pumpkins,0
Yankees winnnn 128153,0
Inspiring a huge crowd of tourists to sit and watch the wild meadow rats over here by the trash cans Cameras are out There is gasping,0
Make my way right to the trash can with these New Season New Shoes WayOfWade http8230,0
when I make the paper ball into the trash can 128168,0
There was a fly that was banging into all the windows and I called it retarded but then I thought to myself umm Im talki8230,0
I cant wait to wear warm fuzzy sweaters 128525978665039127809974965039,0
Scholen waar directie leerkrachten pest kunt u zich voorstellen hoe groot pestproblematiek onder leerlingen wel moet zijn?8230,0
just because you not official doesnt mean you can act like complete trash and be free from acting like a decent human being,0
I get a 50 pound bag of dawg for the mutts,0
WorldSeriesGame3 Hunter Pence is so annoying he should be a Red Sox player Shave fool and take your 2015,0
The John Cantlie video issued by Al Furqan media is a new level of the Jihadi propaganda promises more episodes amp wages ideological warfare,0
THIS JUST IN Yankees P Michael Pineda is ejected from game after substance found on his neck,0
I cant watch Charlie St Cloud because I cry like a little baby Every Single Time,0
One more of tonights dog walk sunset AKA invisible bird on a wire sunset invisiblebird wires,0
Ask the governor how we are supposed to pay for this? Typical teabagger mentality Government is EVIL until we need them LOL morningjoe,0
A light tender yellow butter cake with a classic boiled icing made from burnt sugar,0
ELECT Democratic Nominee Charlie Hardy to US Senate WY Defeat TEA Mike Enzi TNTweeters CIR,0
Syrian Brought to US for 8220Democracy Training8221 Endorses160Jihadis,0
Me and are in our yellow submarine rn 127754,0
Im such a retard sometimes,0
that would cripple our military,0
Youre responsible for the story inside you Dont let selfdoubt cripple your creativity AmEditing AmWriting WriteTip,0
So now been trill is trash cus asap said so 128533 ok,0
8220 Golden Oreos 128016 regular Oreos 1286868221 YES,0
Derek Jeter gets it done JJ Hardy commits error on slow grounder and 2 runs score Yankees take 42 lead in 7th innin8230,0
must not realize how much WVU games mean to all of us The play 162 games a year Sh8230,0
probably time to put this twitter feed to bed nyy,0
We gave GunControl a chance It failed No more of this GunSense nonsense MomsDemand is statist trash,0
cousin why is there a bird on your screen me its twitter cousin i poke you me thats facebook,0
Chilling 1280698482 sexy scally lad,0
I just might buy myself an ARod jersey NewYork Yankees MLB,0
They come to you out of the blue They make others see red and green with envy They arent always black or white Youre not yellow luckily,0
If life hands you a hot potato try throwing it at two birds,0
bro u trash at that zombies,0
CMchat why do U think its so hard forhick hop2get major air time on most stations cmchat when its w8230,0
When twitter rappers dm me their trash links,0
Yesterday I saw a red hair do with streaks of orange and yellow in it Combed up like Woody Wood Pecker And,0
Green and yellow lil Wayne 128155128154128175128175128175128175,0
I hate that wee boy wae the squinty eyes in the game of thrones Suchaprick,0
Just when Im feeling totally useless in the world another baby bird found in need of TLC Just call me DrDolittle,0
It be so good to not gotta woyke in da moanin I da only colored dat woyke cuz colored folk be lazy and lives off da white guilt,0
Just posted a photo Yankee Stadium,0
I love me some chunky babies 128525128525,0
8220 Quote this with a weezy verse Im a diamond in the rough like a baby in the trash,0
I told Mariam to but cigarettes for her birthday You also called me trash rn,0
not only you and that pom stuff? totally porn,0
Uncle leo find iWatch in trash can,0
All I wants is to represent da life o da colored man,0
She has zebra tights in her take home bag me and my mom are just 128525,0
teabaggers weakening food and environmental regulations is infinitely more scary and lethal than terrorism,0
this scally lad would get it,0
A Muslim wmn covers the yellow star of Jewish neighbour with her veil to protect her Sarajevo1941,0
Meanwhile in Canada A monkey in a winter coat escapes in an IKEA via,0
red meat trash,0
so mad We live in a world where whitey can go to jail for a word other folks wear right on their hats amp tshirts If I wore that shirt,0
PND vocals so trash lmao,0
The family of Ron ONeal needs to sue WuTang for that trash song they released in his name,0
Sitting on the deck enjoying a StoneIPA watchingsmelling the neighbors burn trash Missouri,0
Am I the only person that feels disrespected by the bird poop suddenly dropping on your front,0
gator bait 128010128548,0
if Crabtree woulda caught that over Sherman for the game yall woulda said Sherman trash amp he got what8230,0
Burritos are trash,0
Not allowed to play flappy bird around grandma because she swears at me to stop swearing lol,0
This picture on Weibo made Chinas censors add big yellow duck to its list of banned terms 8594,0
128514128514 my fault it sound like it fucc nicca,0
I just noticed you guys called me a jiggaboo,0
Fran is a hillbilly Virginia mountain man who has pre1800s white AngloSaxon beliefs frankensteinMD kikme,0
dont feel like reading right now I wanna give a sexy coolie girl some lyrics via text message,0
UPDATE Collegian dressed as yellow Teletubby will face charges for breakin theft of Chinese food leftovers,0
His do not until playoffs But luckily this means that any future kid will definitely root for the Yanks priorities,0
kit kats trash,0
Epic mickey time? Nahh Two and a half men while i shiver Tht sounds more like it,0
Boy with a monkey tail grows up to the the savior of a futuristic yet old earth,0
Despite the zebra red rocket special portland beats those jersey shore floppers,0
thank you jackass zebras,0
Yanks walk off win 128591,0
Wont catch me sneak dissing thats fo the birds,0
Charlie Sheen is the man lol,0
Jihadis keep on prattling about having shot down today what they think is an Apache helicopter Maybe it was an Mi35?,0
Shades of Eric Chavezs past gold glove Yankees Oakland,0
2 good Jeter hero for Yankees in sendoff via,0
When will Joe stop telling PBO how to do his job? You couldnt even keep a job in teabagger Florida morningjoe,0
On set of BlueBloods Hoping there are no birds perched above me,0
This dumb Berk drives in circles through town on his bright yellow cycle with music blaring,0
Shes definitely a Kardashian bird,0
On the secret Party mission Live tweaking to mock FATPO,0
Flappy bird is taking over my life I can hear the bird crashing every time something goes wrong,0
I asked to get me pink bunnies one time so he brought me yellow,0
You may cry after watching the Derek Jeter ad,0
Charlie Baker,0
In Hopes of Recruiting More Women ISIS Opens Jihadi Finishing School,0
trash TAKE OF THE TONY HAWK SETUP AND PLAY NORMALLY THATS NOT WHAT SNIPERS ARE FOR,0
And the Yankees gave you a win Happy Birthday,0
lucky monkey,0
My baby guinea pig is so cute Adorable,0
IWantToPunchPeopleWho mock God,0
Legion of jig 128557128557128557,0
Black Americans Are Worse Off Under BHO Well researched articlebound to elicit cries of Uncle Tom 8230,0
Oreo ice cream,0
Hear the birds on the summer breeze I drive fast,0
nd you kno how much I love clams lol,0
yellow is even better,0
Watching a bird poop on your car after you just got it washed,0
Matthew 626 Look at the birds of the air and yet your heavenly Father feeds themAre you not much more valuable than they?,0
carrot cake is trash too sweet,0
that was my mock done on a check it out pick your team how many rounds and go for it,0
just because some moist bint lobbed a sword at you you think youre some ladeda king?,0
Dat damn dog eats betta den most colored folk do,0
Because if nobody was judging the birds this account wouldnt even cause a ripple in d ocean,0
damn lol Janay Rice speaks on the domestic violence costume that mocks her marriage,0
Tryna get to home like base to base to base closet looking like planet of the bathing apes,0
me waiting on you to take me to NY with you to get my nips pierced,0
How is that not a yellow on Ronaldo for full on body bumping the ref?,0
Hazlenut coffee and graham crackers every morning 128525128588128152,0
Can we revisit s idea of two teams of playing against each other? I would like to see a game every now amp then,0
8220 Im a mud shark because I have black friends Makes perfect sense idiotic8221,0
8220 Adam Jones homers Yankees now lead 538221Guy is a monsta,0
