text,label
love you too my nig squad,0
thanks Hun lt3 Im so crushed I love working out Itll be 2months gone by the time I go back,0
yes das def da problemif histeacher was a spear chucker he woulda gt both dose rite,0
No not at all Its a slippery slope Just dont want to lose my right to self defense 1st its background checks then?,0
I want to go to the pumpkin patch but the love birds will make it a date and then the rest of us will be,0
Thirsty Giants are always like ho ho ho,0
Were going to make the school look so redneck tomorrow,0
Because humans arent delicious ho Smarter than dogs AND your 3yearold child So why EAT them?,0
Charlie My last two songs will be songs for the sake of whos coming up next,0
Lakers onI thought trash day was Monday,0
Chaber Books BRAGADAYJAH 24 Nimrod the Cushite first king of the earth See Bragadayjah 24,0
I feel the same way about the bigotry and racism of using the word redskins,0
looked like Princess Bella in that yellow dress128120128120,0
Most trash Halloween candy of all time Dont debate me on this,0
a girl tweeted you might be ghetto if u bring food from outside into the movies no u might be stupid if u pay 499 for a b8230,0
Sighs of relief from Beijing Guoan fans amp Chinas govt as club nips Japanese rival 21 in tense match football,0
Never seen a tinted yellow tongue before She just ate a lemon jolly rancher?,0
GMdont be the bird that didnt get the worm today GoStampsGo84,0
Regular joes rockin tha boat thats us redneck yacht clubbb9728127926,0
So Politico says Rney will win and then goes after Gallup for doing the same thing LMAO at you teabaggers morningjoe,0
Thanks for the follow guys Im enjoying a cold yellow belly right now,0
would be perfect wa graham cracker flavored bun or a maple dougnut bar,0
Thats what sports are about Forget the arrogance amp trash talking Its about making people feel like they are a part 8230,0
They say our state bird is rareI literally see one at least once a day,0
Disturbing feeling pressure from ISIS fanboys Al Qaeda fanboys resort to celebrating 911 to reclaim their Jihadi bona fides,0
Idiotic censorship drive by France President fails to understand that hes empowering Jihadis by censoring the internet wholesale fail,0
Best rider? That goes to a blaxican,0
how long after the name change will al memorabilia wredskins name be deemed racist and therby illegal?,0
Oreo Shake,0
We wacko birds are still tweeting MakeDCListen,0
Chest tattoos on females are trash,0
trash,0
fuzzy socks are the actual life,0
I hate Hashtag activism No lie I think 95 of it is trash,0
You never survive in da colored hood,0
This hot chocolate and Famous Amos too bomb right now,0
ghetto sour cream,0
lemme just throw a 302 in it hows the tranny??,0
Jihadi rehab needs to account for the unpleasant fact that its the worst behaviors that attract participants,0
Harlem World trash? Interesting,0
On this ArmisticeDay the cry Never Again is absent and mocks our pledge to NeverForget the fallen from ancient an8230,0
Like I said I might have to check but Im just not sure bird shot counts as getting shot,0
we have a project that could lead into a military program but requires a full op mock up for testing,0
So much more going on but hypocrisy doesnt sit well with me My redneck family from central Illinois more black then Bieber,0
I like the Yankees toinight 107,0
Remember in 2001 when the Yankees were in Boston and the crowd was cheering USA instead of Yankees suck I love baseba8230,0
can my cat not kill birds and make a huge mes of feathers,0
honestly the performers on there red carpet were trash hahahaahahahaha,0
What ever happened to the Teen Titans of my day and why must they mock me with this Teen Titans Go?,0
Getting ready for the annual heart and sole luncheon cle with,0
You are hairy like a monkey P,0
eh take off hoser,0
youre secretly a Yankee fan Youll admit it some day,0
The Saints are pure trash lol smh,0
Working Saturday is for the birds FML,0
When your phone goes off in class and the teacher says turn that trash off but its a song from your mixtape,0
how could you say such a thing woman? You have two chest tables to hold your peanut butter and crackers,0
ha booner has that twitter ha,0
I dont care how pretty you are if your personality is trash men are going to treat you accordingly Thats not tru8230,0
Panda Express is so trash but I wanted Chinese and didnt feel like gettin out the car,0
Get here MT Sierra skiers offers a fun break from the slopes Sweet deal TravelNevada,0
How long are they going to let the fools in Ferguson continue? Stop pussy footin amp disperse them by WHATEVER means necessary,0
Early bird gets the worm right? Hopefully I get a job soon after today,0
dubya hates todays teabagger movement,0
My anaconda dont 128581 My anaconda dont 9995 My anaconda dont 128683 128079 Want 128079 None 128079 Unless 128079 You 128079 Got Bunz 128129Hun,0
Note Khorasan is the old Arabic name for parts of Iran Afghanistan Not an invention of modern Jihadis justsayin,0
Ultimate Chocolate Chip Cookie n Oreo Fudge Brownie Bar,0
Charlie Rangel ReWrites History On GOP 8220They Think They Won The Civil War8221,0
sav you are so nicee love you too twat,0
last year i had to explain why queer theory is the acceptable academic term,0
Ill be a Yankee fan forever,0
BREAKING Japanese ace Masahiro Tanaka will sign with the Yankees for seven years 155 million via Fox Sports,0
Early bird catches the worm 128074,0
I hate stereotypes Preconceived notions that black men are athletes or criminals Black women are ghetto and confined to t8230,0
this Charlie Z really does need mental help check this out,0
I openly admit to being the level of white trash that will drive across town to the gas station with free hot dogs amp half price drinks,0
The crows warned you to stay away from the island Will you? THE SOUL COLLECTOR IAN1,0
Fox News mocks victim of Ray Rice elevator assault 8216I think the message is take the stairs8217 ht8230,0
Got to 8 on flappy birds can you say happiest girl on earth,0
triple fudge brownie chunk ice cream LifeChanging,0
Rose colored glasses only you guys wvnextin6,0
US spy planes are flying over British skies in hunt for Jihadi Johns assocs with advanced tech via,0
Grateful for the profound hospitality of volunteers who open their homes to patients traveling long distances for abo,0
sowhite people selling African art? NOT COOL? Okay blackish redskins doublestandard,0
127867127867127867127804128153127913 plus Sheryl crow,0
i see you again didnt election bird for government america that okay i guess i just take this free cookie for everyo8230,0
Pregnant SE Cupp8217s classic response to 8216liberal dem8217 who calls her 8216chunky8217 8211 with bonus tweets via8230,0
baby monkey in the snow im crying 12855712801810052,0
How long after the redskins change their nsme will all memorabilia wredskind name be deemef racist and therefore illegal? Any thoughts?,0
9733 BEST ASIAN MASSAGE ON THE Brooklyn Park slope TOP RATED SPA 24,0
Just as trash as the others Fixed none of my issues Naw Anyone download ios 802 yet?,0
California has gangs because California is trash,0
rubs hands like bird man,0
My nudes are trash,0
How bout them redskins?,0
If anyone wants to bring me a sweet tea to my party Thatd make my bday perfect Well that and cracker barrel,0
no song Ive heard was good is what I mean by hes trash,0
My nig took me out for some more of that good old New Orleans soul food,0
Last time xfactor auditions came to Dublin I auditioned and And a man in a blue monkey s8230,0
having a blast even had me on the monkey bars tryna kill myself lol,0
squak squak squak squak Me bird shut up squak Alex that was an act of defiance,0
That dude from Chicago w the fuzzy mustache and bangs Johnny Love hes whack,0
JSU coach Omar Johnson Its what u do against the ball U throw it hit it catch it Doesnt matter if the Yankees are 8230,0
MustWatch Bill Maher Schools PBS Host Charlie Rose Over Islams Illiberal Beliefs,0
The fact that the Bruins drafted a Yankees fan just goes to show how weak the scouting staff is IMO Didnt do their homework firechoreli,0
Never seen purple bird poop until today lol,0
Is Yankee in a good mood today or what,0
theyre so goooood I just want like a savoury salty cheesy cracker,0
groves is trash IMO,0
Certainlt not the paddies,0
such a sucker for some Oreos,0
So I took a 1000 pictures with him and he ate all the brownies I made but hes the new homie,0
Nah ITS OVERgt People dont tell artists what do to Thats defies the definition of what WE ARE TRYING TO SHOW youpeople retards game7,0
He gets this bratty attitude from Brittany and its for the birds,0
Where has this been all year? But still FireCashman Yankees,0
youve got no sole,0
Gonna shower for the sole purpose of shampooing my beard,0
portlandia putabirdonit The Xbox One would be so much cooler if they put a bird on it,0
Ill give you a baby zebra girl,0
This is why nothing gets done Morons like Coburn trying 2 ad a gun amendment 2 a public works bill Push back on the teabagger morningjoe,0
BlessJesus Amos 33 Can two walk together except they be agreed?,0
HellYeah No Happy Fall Pumpkin Spice Oreos are here,0
Un pollito cruzaba la frontera un zorro se tropieza con el pollo el zorro le dice im sorry el pollo le dice im,0
u want me to make u one of my ghetto nunchucks they come in singles and doubleended,0
the bird with the aim of dreams,0
stupid teacher talks to like hes retarded,0
I got to get the trash out and make for the Frau and start laundry so yall be good till I get back Cracker Out,0
Done for the Yankees,0
Me amp hubby relaxing from the studio for a lilthen headed str8 to my honey doo wop wops bday bash Kristen,0
Charlie Sheen did the ice bucket challenge the right way,0
Getting off twitter jigg trynna stress me out more I dont need this type of heat128553,0
Sonia never criticises Kejriwal who trashes every other leader never criticises Sonia Touching YoK8230,0
In the fashion world urban definitely means stolen from black people its ghetto on us and urban on them haha,0
Thee Bears are trash tho,0
You cant see it but Im flipping you the bird,0
negative slopes aka a chart of my grades in math,0
Eli Manning just threw his NFLleading 27th interception of the season Lmao trash,0
I agree 100 No naturalized citizenship no anchor baby amnesty All go to parents country of origin,0
Lmao Lowkey Peyton Manning trash,0
Shy people tend have great observational skills making it easier to recognize the core of a problem then solving it,0
Given the rickety slant of that roof Id say more like Pizza Shanty,0
BREAKING AP calls Mass Governor race for Charlie Baker Watch live coverage on WCVB streaming online,0
BlessJesusLove Happy Belated SixtyFifth 65 Birthday 28 Aunt Mary Agnes Strong,0
Finally done wif mock regents 128524,0
The stars wink knowingly and smile at each other when they see two lovers kissing on a secluded bridge on a balmy autumn nig8230,0
Hungover and feeling yyyyyeelllloooowwwwww dbh yellow,0
Wow Such banana So potassium Much yellow,0
pornandroidiphoneipadsexxxx Teen Cutie lesbian teens toy slits,0
Monkey see monkey do really Abu,0
well since you is blood you get a G pass but only this time and I wont tell wop about that lyric,0
This mint brownies recipe is made with almond flour coconut palm sugar coconut oil and coconut mi,0
On the anniversary of 911 ISIS amp Al Qaeda supporters each claim Ben Laden as their own as a show of their Jihadi authenticity pathetic,0
Im just tryna get to sleep before the birds start getting rowdy,0
Come on Charlie OUR GOVERNMENT WAS JUST TRYING TO PROTECT THE DESERT TORTOISE Atleast thats what Barack Obama Says,0
Twice divorced teabagger Florida Attorney General says marriage is reserved for stable enduring family units,0
thuggery? Cheating? Talking trash? Whos doing that besides Jameis? And isnt ND in the middle of cheating issues?,0
A ghetto girls best bet is to find work at a call center and try to climb that corporate latter,0
218 Covington reads responses amp mocks FBI Andy on Real Politics Liv on her awakening Gretchen,0
Im finally finished work Im going to have to chug this bottle of wine to catch up to you guys Challenge accepted,0
Vice President Biden amp his wife are in Florida today to stump for Democrat Charlie Crist in his bid for Governor,0
ATTN All Brown University students the stop and frisk protesters will be systematically dispersed into random US ghettos Good luck,0
Dis nicca went in on dat I Keep tryin,0
cheeky lol I want those all black and yellow 95s again ughh I 9825 those,0
Enjoy itIm happy for youbut I hate the Yankeesand yes the Sox did choke,0
6000 peopleday now being deported from Warsaw ghetto packed into cattle cars for rail trip to Treblinka death camp htt8230,0
Whos to blame for the Yankees underperformance this year? The Umps? Management? The Ebola Outbreak?How bout the player8230,0
I know how you feelI never thought Id see the Sox win in my lifetime Hope you can use Ants Yankees hook up to see a game,0
Lakers fans will feel the pain the Yankees fans are feeling today at the end of basketball season,0
Practically got arrested tonight not allowed on UTampa grounds for a year now fml im retarded,0
the song? About pollo hermanos and Heisenberg?,0
i reblogged them to mock her god bless,0
A bird doesnt sing because it has an answer it sings because it has a song,0
BreakingNews streetart graffiti new mural by duo EtamCru in Rome Italy morning breakfast coffee trash,0
I found your arm in that trash receptacle and your leg in the mud down by that streamYou should consider keeping better track of your limbs,0
I am a celestial body hello,0
I learnt about birds as a child Best time to learn,0
Its Perfection My brain crossed wires or something I dont know why I came up with the ghetto one,0
A birds eye view of todays harvest14 activities Thanks for the great camera work,0
They come out Charlie Sheen They come out coupe machine,0
anybody want any sugar maple saplings? I have about 50 popping up in Heidis hillbilly beach me and emms planted two Friday,0
those crackers will leave you parched asf,0
Your A Good Gravedigger Charlie Brown SpookyBroadway,0
Posted a new song guala music,0
its mutual my lil yellow bone127827,0
Bae means before anything else I always thought it was a ghetto word for babe,0
Of rain showers amp weepy fog of soft light amp cool touch of wild wind that carry music of birds who cease to soar this feel8230,0
Yankees getting killed,0
the rams really dont wanna be trash jeff fisher really bout it,0
How many Yankees players have 3K hits? You have to put DerekJeter in the conversation for Best Yankee Ever His numbers demand it,0
yellow,0
birds of a feather You stand with PETA I stand with sanity,0
im wearing a sweater and its ike 80 degrees in my house,0
thats ghetto,0
Its retarded Ignore the harlem shake fad and hope it goes away soon,0
red and yellow it should be then,0
Oriental rugs cause Im flyer than a dove,0
Nick Young says that close to 100000 worth of money watches sneakers and clothes were stolen from his house last nig8230,0
teabagger state like mississippi opposed to minimum wage child labor laws unions is proscab sweatshop work pretty much SLAVERY,0
Taria the filterless sisdari the angelic sisim the big bro lol and jigg lil bro128553,0
They must be Russian birds Russian birds are known for invading Chiminea,0
Knock em down wit sum chunky 128548128299,0
thats the beauty of them brownies I always daydream about what Id do if I hit the powerball lol nerdy but fun,0
after the steelers lost the superbowl i loaded up the black and yellow gmix on my moms computer i think the youtube page is still open,0
If you honk your horn 4 seconds after the light turns green I will shut off my car lay on the hood and feed birds fo8230,0
Theres a reason why the Yankees dont want Anderson any longer,0
Now Im listening to lil spook getting the good kinda sad Imma be single this fall I know youll getting annoyed with me on your TL but aye,0
When this test is over today Im making a pan of brownies Im going to lay in bed all day amp eat them until my heart is content 128524,0
Yellow jackets at gas station trash cans are THE worst,0
How Shy People Flirt Learn tips from the best,0
Dear Oreo Whats this I hear about a Watermelon flavor? KEEP YOUR FAKE FRUIT FLAVOR OUT OF MY CRISCO SANDWICHES Love8230,0
Lmao redskins turnin up,0
As long as its not one of those special brownies right?,0
republican teabaggers should be jailed for treason,0
Stop Smokin Bathsalt Charlie Brown rejectedpeanutsspecials,0
Dominoes moonlit lake Velvet Underground honey whiskey white trash heaven I accept your ridiculebut just tonight,0
When Charlie tries to walk into my room and it cant remember if I locked the door or not,0
Pity parties are trash amp I dont throw them,0
oh Ill make you some brownies alright,0
I have no clothes that make me look like a redneck but I tried my best 128514,0
Im jus a trill nicca mane,0
Yes yes I know all about the FOB IT WAS MY IDEA Youre welcome,0
Its a plane its a bird nah its just me doing laps around the dam Lol,0
I think about the fact that dinosaurs evolved into birds every time I eat chicken Dinosaurs are delicious,0
LED Christmas decor Lights 10m 33ft 100 LED Fairy string Light for OutdoorIndoor,0
Just saw Dawn of The Planet of the Apes One of the better moves Ive seen this year I didnt know if I wanted the apes or8230,0
why did they add your name all ghetto like that? Looks like they used label maker lol,0
Asains had to take the Wu Tang Clan the draft was suppose to be for half breed like me and,0
Yankees Unveil Beautiful Derek Jeter Cage In Monument Park,0
8220 Frogger best game ever8221 only cuz You suck at flappy bird,0
Show your support during FleetWeekNYC with troopthanks You could be on the billboard in Times Sq,0
Obama mocked the special Olympics Wendy Davis mocks the handicapped do ya see a pattern? Democrats tcot UniteBlue,0
I be wishin you was local I takes you to da Yankee game and spoil you,0
bae won his game 128525 redskins,0
Riff Raff is trash,0
Best CollegeGameday sign ever The Dakness is spreading Charlie Murphys True Hollywood Stories ChappelleShow,0
Charlie Sheen gets it,0
Tommy trash,0
Your tweets remind me of the times when we did the Oreo milkshake runs 1am in the morning,0
8220 I survived swine flu bird flu west nile and the Bloomberg administration Ill be fine8221the abortion survival Cant 4get that,0
Id be the best at owning a bird I could teach them the funniest things to say,0
Pink albino dolphins are extremely rare but do exist in the wild,0
jig levitating for lousiville,0
Someone tell the royals to stay home there trash128553,0
trash af,0
teabagger math,0
u look like that fat kid on Charlie walker the that got stuck it the chocolate tube,0
Brown colored eyes are really blue under a layer of melanin,0
Suddenlink is trash Yall know how important Bubble Guppies is to our day?,0
I cant even find it in me to mock anymore This is scary This mass ignorance is terrifying Yes alas I agree,0
yellow rice black beans and pork chop sis,0
According to my brothers iPod its December 1969 If so I predict that Mickey Mantle of the NY Yankees will announce his retirement March 1,0
I can only hope Charlie Strong UTcoach,0
Early bird gets the worm but the second mouse gets the cheese RiseNGrind 128175,0
Would not spend my money on trash like that,0
Everytime I see Nelson Agholor make a play I want to puke Kid shouldve been a gator Thanks Charlie Cheeseburger,0
Saw a man in a yellow hat at the Grand Canyon today He was hanging out next to a curious gorge,0
Friends of has let me know that Phil is very ill His infection has gone septic and he is fightin8230,0
Congressional Hopeful Richard Tisei stops in at Bakers Swampscott Rally But still no Charlie wcvb,0
Girls that wear colored jeans 128525128527128076,0
Hot off the press here8217s Todd McShay8217s first postCombine NFL mock draft including a new No 1,0
I was born yellow,0
Thats ghetto for super duper Its the current generations best complement,0
SimplyAddictedToGuys woof woof hot scally lad,0
top layer trash,0
New jersey should be yellow with a green chevron stripe like charlie browns jersey,0
AND NorthKorea called Barack a monkey LOL If the shoe fits Cause it sure looks like he married one,0
I didnt know whitetears were blue and yellow lessonoftheday,0
Norwalk ghetto af lol all of a sudden everyone a dodger and raider fan,0
I just need the Yankees to win the pennant,0
You speak colored too? I thinks I be in love,0
This whole week was trash,0
Naw Im trash Keep ya pity hugs128530128133,0
Kanyeeeeeee is just a yard ape acting idiotjust stupid,0
Im redneck crazy,0
If your boy breaks up with you and has a new girlfriend a couple days later then there was something you didnt know abo8230,0
teeth can make or break a person you could be a 10 and have yellow teeth and drop to a 2,0
US ghettosdriven by liberal ideology forged by unions amp bankrupted by selfserving Dems catering 2parasites tcot,0
I found a new way to chug you have to open your mouth alot,0
I realized its the one on Links Awakening too so you killed two birds with one stone Unless youre getting the Wind Fish too,0
Shy girls are cute,0
Im not mad cuh hahaha suure tuku ho ita 128514128514,0
BlessJesus YesFeltand touched the soles of the humanity with stains and impressions that only leaves its reflections,0
Lets finish strong Yankees,0
Its a bird Its a plane Its a boat NoIts its a flying human? lakeerie cle,0
Listen to Charlie Daniels speak the truth amp then enlist in the US FREEDOM ARMY at,0
jacob u look like a monkey in dis,0
I wonders why dare aint no colored folk up dare?,0
He no doubt copied it from someone else Alert The mock turtleneck is back,0
8220 Traded in my nikes for a new mic I guess its safe to say he sold soles for his new life bada8221,0
being up at 5am cuz your cat meowed at a nocturnal bird is the ultimate toughbreak,0
Lil Kim really made herself trash smh 128148,0
Congratulations for reinforcing the stereotype for insecure uneducated uncivilized ba8230,0
Alabama is overrated this yr the last 2 weeks has shown too many chinks in their armor WV gave them hell too,0
PND is my jigga man,0
I see So you feel betrayed your racism comes out Shocked you didnt call him Uncle Tom you bitter loser,0
Neonics are deadly to birds like the American Kestrel and bees Ask to take it off their shelves EcoWed,0
lmao it will have a slope of 2x1,0
Report what u want But physically chasinghounding is uncivilised Also in case of BansalGadkari 8230,0
Will Coakley go 02 in cant lose races? wow just wow Charlie Baker for Governor htt8230,0
One of my favorite songs Theres a man on the shoreline with a white parakeet trying to make his bird go home,0
Its proven that no one can not cry at least once while watching Charlie St Cloud,0
8220 Rand Paul mocks Clinton with HillarysLosers pics with failed candidates,0
If I could be anywhere on earth right now you know it would be Yankees Stadium,0
Sonia never criticises Kejriwal Kejriwal who trashes every other leader never criticises Sonia Touching,0
I want some cookies brownies and ice cream 128523,0
The shines its lights in Yankees pinstripes in honor of Derek Jeter FarewellCaptain,0
8220 A lot of them are though Attitudes be pure trash8221 TeamWhiteGirls SwirlTheWorld,0
all trash to me,0
Check out the homie for that sole sauce That stuff does miracles 8230,0
So who wants to tell the Washington Post that Charlie Crist is a Democrat?,0
Im an 18 year old gay driving through the back roads of redneck Virginia blasting Cheetah Girls If that doesnt scream sitcom what does?,0
whoever made this twitter doesnt like the Lakers they r making a comeback but this accnt still continues to trash talk em,0
How day feel bout colored folk?,0
NoTVDuringtheWeek parenting rule has thrown quite a monkey wrench into RooseveltsPBS viewing schedule DVRtime 8230,0
all that trash talk and we win championships Youre boring me dude NationalChamps,0
Jones and Iba241ez are out of gas after giving it their all earlier in the first half The callups should get more playing time Yankees MLB,0
Yankee Doodle had a farm Cotton farm,0
Oreo Frappuccino,0
When he wraps his arms around my waist while Im making dinner yellow roses pearls Anything COACH a,0
Weird frosted colored lipgloss is weird,0
Brandon Jennings trash,0
Tiny out here looking like an albino red nose pitbull from a dope boys trap house,0
Great story of what its REALLY like to be a camel jockey at the Camel Races in Tra8230,0
I keep running under trees or when birds fly to avoid their erm being targeted by their lack of a digestive system,0
Why yall doing the ALS challenge if yall not gonna donate? Cuz we dont 10k amp Tiger Blood to donate unlike Charlie 8230,0
is he chunky?,0
taking out the trash at night,0
For the last time The Captain takes the field at Yankee Stadium,0
I told her too I said bri dont get in tweef with anyone because youre trash at it and then she goes and tweefs with like 6 freshman,0
if youre making 300 clams for betting 5 i hope you do it for a living,0
Nah Electric Fairy Tale seems cool but Id rather buy some drugs with that money,0
Oh me too Pain meds just made my brain fuzzy and though Banjo Kazooie for a sec,0
My phone on 10 fml I still gotta get to the yellow sign lol lol btw I zoomed in 2x lol,0
graham crackers with marshmallows the little marshmallows and little chocolate bars and we can make smores man,0
my I kid you not eats bacon without dipping it into the tub of creamy butter Ive laid out Im like what are you a bird?,0
song trash,0
Fake pics get off my TL u r dismissed muzzie,0
Red Hot Chili Peppers with the longest nipslip in Super Bowl Half Time Show history,0
Clever Watch Burfict make the hit and then mock officials by throwing a flag on himself,0
Nope Its just yellow OTL,0
SOO when we hanging out and makin brownies,0
Morning trash,0
