text,label
8220 Tell a hoe NO for the sanctity of your relationship we gotta stop fucking these woman8221,1
Every females worried about being played amp every nigga worried she a hoe So nothing but games will b played wit that minds8230,1
8220 ion eat cat 1285818221bitch what you gay for then,1
Khole Kardashian pregnant by French Montana guess she put in work and popped that pussy lmao,1
I wish a bitch would,1
yeah it was such a lie thats why you deleted it nigger,1
Somebody tell these broke bitches stay in they place yunstand?,1
Yall still going trick or treating this year or nah?hell yeah ima be da sweet tooth bandit steal bitches bags n shit,1
8220 If you aint got shit goin for ya self what bitch gone want,1
Yo this bitch in Macys tried to run out the store with a gaggle of clothes and got caught,1
he wants pussy nd a dini mean a cat,1
I hate when people say you cant befriend a hoe How bitch how? 1 Im only held accountable for my pussy 2 Its all about8230,1
Blatt trash too but twitter said he was good,1
so a man who is a pussy and a coward you and easily took what was yours? You are clearly much less than a man then,1
damn amp fire flowers for the ladies amp dick for the hoes lol,1
no thats fucking retarded are you drinking tonight or not?,1
be like Yall got me fuck up Im dicking down them young PV18 bitches for there refund check I got to pay rent,1
I know im not the only niggah that saw that,1
When yall having a good day amp she brings up a bitch from Twitter,1
Real men ask for nudes Correction Pussy ass bitches ask for nudes Real men are out there working for women amp actually h8230,1
Tell them bitches Ill always be your Mrs128141,1
wow she let quite a few niggas beat equal opportunity pussy,1
You and should name a group called MOB Moaning old bitches,1
Those tell me about yourself lookin ass niggas Ima crazy bitch thats all you need to know,1
A fuck aint shit to these new age hoes,1
If I was a girl like that u would probably eat my pussy Jasper,1
Rich dollaz always trynna snatch a bitch Like he a bitch 128514,1
i thought you had some fucked up birth defect that made your nips heart shaped lmao,1
Whoever came up with that I dont have no exs sayin mustve been a hoe,1
lmao soft ass nigga trying to act all tough you a little bitch Sit down and watch from the sidelines pussy,1
hes texas trash bro,1
If you got to act like you cuffing a bitch to get ass your a lame forreal 128514 real niggas let bitches know what it is from,1
Andrewbryant Poff has double vision after 2 beers Poff Double pussy 128526 smh,1
These hoes aint loyal,1
Drink up bitches,1
At least Im not a nigger Lmfao,1
im not rude most people are just sensitive little bitches,1
All I ever do is fuck bitches amp count stacks,1
requires soundcloud links and tumblr bitches he MIGHT let you play his party then,1
dont look at me like Ive got a banana in my hand you fucking monkey,1
bitch I didnt even know you I was only fucking with real niggas and damn sure wasnt one of them,1
yall both gimped up?? Aint tht a bitch huh lol,1
These new bottoms are something else You put nair on your pussy for the gram? Ok,1
My two main wiggas and I,1
bitch you beat after losing twice lol and we won 11 you just a hater,1
Never let them hoes get in between of what we started,1
Run up on a nigga get to squeezing hoe hahaa,1
rapeyass Uhnot rape her bitch nigga? You see her passed out drunk what do you do? ht8230,1
I swear I got that shit that make the bitches go insane,1
Ross got Amber Rose naked these hoes aint loyal wiz,1
Fuck a hot head pussy I gt a cold heart,1
Shut up bitch i wasnt gonna roast,1
Gucci Mane in jail and dropping mixtapes every month and you hoes cant even text back,1
Time hop makes me realize how much off a faggot I was lol,1
Listen here 8220 Bitches cheat on they bitch But be SOOOOOO HURT when they bitch cheat back8221,1
Im such a bitch to Austin 128514128514,1
Aw thats cute your mom raised you to be a bitchy little cunt128536,1
Can this bitch sit the fuck down and shut the fuck up,1
Just saw someone riding a bike while wearing camo the bitch is asking to get hit,1
I see da dayd presidents coz my bitches and hoes be makin money day way,1
Bitches be talking about they ride or die with every nigga they talk to bitch you done died like 8 times already,1
Karma sure is a bitch Lol,1
okay bitch Tomorrow in the principals office Be there,1
This fat bitch got all huffy cause she took too long to make her turn so I took it so she mouthed off to girlbye128129,1
nick when the men are talking sit your bitch as in the corner and listen to this grown fo8230,1
I had a bitch that had a bitch had the bitch eating halibut FreshRhymes JerkSquad SlowStir,1
Never did like that bitch,1
They trash Pointless Bitches In The Club Smfh,1
Wish i had a bad bitch tonight where they at?,1
Lol everyones a lil bitch,1
Fucken pussy,1
so you gonna believe mea cripple or a fuckn hippo??,1
All the ratchet hoes on Cecil B,1
When someone tweets these hoes aint loyal but they laid up at the crib looking like,1
Thats who dumb bitch GoHawks,1
they probably hate me even more because not only do I look white when Im a poc but I have white hair now Im double cracker,1
These hoes be thinking Meat wont slap they ass 128564128075 ainna bruh,1
hoes,1
No time to play wit bitches,1
8220 bitch I was fukkin wicha but fuck you nigga square up8221 and Im fucking with you 128514128514128076,1
Hahahaha When her pussy better than you expected it to be,1
bitch get naked Works 10 times out of 10 if shes drunk,1
Lol I never retards who use the atm and pay a 2 fee to get 20 and put it in gas so the dont pay the credit price,1
only bad bitches in roe r u amp,1
right because as far as im concerned I aint no bitch tf,1
Go die in a hole bitches 9996,1
Get cunts to threaten me not bothered Id happily hit up a big massive group ae third years or something hahaha dropkickkk,1
corny ass hoes always got my name in they mouth,1
It aint nothing to cut that bitch off 1007165039,1
i remember a time when Hilfiger wus seen as being above Polountil he said he aint wan niggers wearing his ish,1
my bitch,1
i need 2 of the bitches,1
correction bitch yo illiterate ass wanna eat my pussy and I got some center street boys dat u can suck up nun major,1
bitch,1
Fuck bitches get touchdowns,1
Jus need a bad bitch thats gone always hold me down,1
Smoking weed is so Haha I was trying to get high bitch Im not trying to turn you on,1
Hanging out with guys does not make you a hoe,1
man some lame niggah when I find him Im TF out his ass,1
damn I just got called a hoe,1
This chick looks like she straight up took a colored pencil to her eyebrows,1
Bad bitch contest you in first place 128175,1
So yams are ass or pussy?,1
Some of yall females undercover hoes,1
Im glad to see that broads are still into the faggot look when it comes to picking dudes,1
Its ya boi popsley da 83ar aka the real meek mills I was on this earth first pussy,1
80 60 of these hoes be fake gay,1
fml both or half breed ex at the gym Ugh,1
8220 127850127850127850127850127850 bitch ass nigga fuck you lt these hoes aint got no manners RealTalk,1
This bitch in 711 wit hella face tats She a female duddy 128527,1
How filthy of a cunt is to pretend that Obama threatening amnesty is not vastly more egregious than Boehner on Obamacare? tcot,1
I be lonely128514128514 I have no hoes 1285531285149995,1
Im Tryn tell yall brah I went wit a slut n could not stop da bitch frm boppin dat shit scary,1
ewww I said THAT last Sundayas in the last Sunday I was there Read it again,1
your still a little pussy tomcat 128569,1
Karmas a bitch 128514128514128514?,1
fasho fasho Hurry ya ass up nicca,1
it was the address to her Job So the jokes on you bitch Ha,1
Havent talked to my bitch in a while lol,1
If u know this bitch u know ur mexican,1
Dont trust these hoes,1
slap these hoes on the ass like we birthed em,1
bitch I died when I read that,1
Niggas get pussy in the friend zone,1
I guess this is the night bitches die Stewie is that nigga,1
Niggas love cuffing hoes then acting surprised when they turn out to be hoes,1
pretty sure you meant flight and not flite dumb ass cracker,1
SO to my Luus These are down bitches Dont fuck with them,1
hurt ass how ah whole nigga hate on a bitch ???? tf,1
I need a bad bitch thats gon treat me good,1
omg bitch go to sleep it was JUST a coincidence huh ? 9995128514,1
I dont Light skin Bitches will have 30 unread texts amp still tweet Nobody to talk to You bitches is outta control,1
I cant stand you I dont text first ass bitches,1
I drag a bitch by her hair CAPTAIN CAVEMAN NNN,1
First I charge my phone then I text your bitch,1
prego bitch,1
the only place I ever ask them to drive me is to the rave for shows and they fucking bitch about that,1
Late night phone convos with my hoomie that nigga a gook,1
he was no more a cunt with a shitty attitude than Apex or Pamaj or Banks,1
suck a dick hoe,1
Theres like one of my exs thats still kinda cute Most them bitches got fat,1
Right you are Have you heard of the dodo bird? Hes the one with Obama on his ass,1
All my old hoes gone love my video,1
quit being a pussy,1
Gemini gets irritated by jealous bitches,1
You know how trash of a grown ass woman you gotta be for a nigga to be fucking around 17 year old? 10 year old landfill trash,1
I am absolutely speechlessThat bitch is CRAZY,1
Nigga a dyke Melo garbage ass just now hitting 20k,1
1000 rts and hell spark this hoe in here,1
Ronnie Radkes a fucking fag Fronz owns his ass,1
Females say have a seat faggot amp they feel like they put a bullet in yo head,1
givenchy my toes and my bros and my hoes,1
8220 Good pussy have a Nigga like funniest thing Ive ever seen on 8230,1
I cant handle when people give me an attitude I dead them so quick Like why do you have to be a nasty bitch,1
I would dead upper cut that bitch,1
Merry Christmas everyone Unless youre a fucking bitch then literally just go,1
Like some nigga lie to bitches amp wonder why they go crazy That aint me,1
in your own shit now pussy what a joke youd end up just like all the rest no show chicken shit mother fucker,1
bitch i got the flameeee,1
ooo Logan pulling bitches,1
last words to a bitch nigga why you lie,1
everybody fuckin everybody bitch everybody wit the shits thats lifee,1
128514128514128514128514128514128514128514128514 you a faggot if you eat pork chops,1
u aint bout it wop,1
damn son maybe he didnt know it was ya piece He was just Tryna get some pussy breh,1
I cannot be worried bout no bitch Cause I know a bitch could be somewhere sucking a dick ayeeee,1
bitch think she know everything ha,1
my niggah my niggah lol,1
Just smoked a whole 8th of that Reserve thanks to my niggah,1
I wish alot more females would tweet about sucking dick Im tired of me and Twitter niggas tweeting about eating pussy We need balance,1
Ill continue dis later Ill be back bitch,1
I want someone I can call my own without another bitch staking claim on him simultaneously,1
This nig johnel keep falling asleep Thats usually me lol,1
if bitches Tryna step to us,1
you say waste a draft pick on Manziel when we have Mallet thats why Im telling you to delete your account Youre retarded,1
Behind every REAL bitch theres a bitch ass nigga that did her wrong but made her strong,1
Jtfooooo at pussy on fleek,1
Los bitch taught me the true meaning of gravity when her panties kissed her ankles,1
This bitch just texted me out the blue bout want see her butt,1
Up runnin these 2K fades with ma niggah Tyreon 10433231043359 Leo KOd lmfaoo,1
Hoes gone be hoes but thats none my business,1
bitch,1
I want some popcorn hoes bol,1
hey cunt I miss you 128557128557,1
Fake ass hoes all around,1
one time for the illest bitch alive,1
I shouldve fought you when I was over there if only I was myself and I havent popped that talking about u only need two hits bitch please,1
Met this bitch online Call her my ebae,1
If you one of my hoes make yourself known,1
Im feeling pretty fuckin ghetto Smh,1
if he wants bitches tip toein on his marble floors he will 128521,1
Wheres this bitches parents tho Go home you thot,1
Pussy will always be my fav iggy song like how do you not like a song that just says pussy numerous amounts of time,1
say that hoe has sparked a many a blunt since you left it,1
Waterproof lab coat in case I drown in the pussy swag,1
prolly sum hoe tryna get in the hurricane free who sent that nigga to Twitter tho,1
Maybe she wants to be more than your friend or maybe shes a stupid bitch You never know until you make her cum,1
Love fat hoes n tight clothes n granny panties seeeexxaaaay,1
The ones we really like we cant get But if you got the one you really like then you a lucky bitch,1
why niggas put heart eyes under everybody pictures? 128553 then it be them poo la la hoes,1
You a hoe and errbody know,1
got all the bitches,1
you both sure do You want to give a free pass to every border jumper in this country you two are whats wrong here,1
why do you call most guys that talk shit to you fags then? You should use another word hypocrite,1
You just a Twitter hoe,1
lmao whore my life on a bad day is better than any good day that youve ever had fuck a day bitch haha,1
8220 why do bitches stand like this? she wanted to be in MJs smooth criminal video so bad,1
O didnt know?? Sure hes a little bitch Valerie Jarrett on the other hand you betcha That guy knows eve8230,1
So I ran into a dude I went to high school with amp he used to be skinny as hell Now? Omg Same fucker who slit my tires years ago,1
8220 I hate a bitch that like to argue n shyt8221,1
Marilyn Monroe set the standard for what hoes can achieve in society,1
8220 Im sorry I offended you when I called you a bitch I honestly thought you,1
Cant get no money from me you silly hoe,1
Im just looking for a bitch that can hold me down,1
Bad bitch give me head like lice,1
neva been a bitch nigga you dont want them problems bro,1
So damn sick of that damn lie girls look like iphones when they jeans come off bitch stop lying,1
Fucking pussy bruh lol,1
Idgaf about you regardless bitch you got me all day,1
warning shots are for pussies Im just gonna gun you down And steal your pink boots,1
Cocky bitches with front teeth that stick out from suckin they thumb lt,1
no pills jus weed kill dat pussy all night damn right sho u right,1
dont fail bitch,1
I never had any friends the entire time I lived in Virginia No one was cool to me I hope those white trash all die,1
Came home and found my cat sleeping on my pillow c I love that niggah,1
the next call will be to w your Id your sex reviews amp your ad bitch I warned you you lie I have facts amp8230,1
Monkey see monkey do Narnfraud? Swiftee amp Narnfraud pathetic and disturbed pair of thugs mngop proud? stribpol,1
Man this bitch smells like cheap lip stick,1
touch my throbbing pussy,1
pussy,1
You niggaz is bitches better yet actresses da k hit ya ass nd flip you like a pissy mattress,1
I feel like a bad bitch when I wear my rhinestoned pocket jeans,1
Id rather have a flat bitch then a bitch who cheats128521,1
8220 Throwing lamps at bitches who need to lighten up8221 True dat,1
life aint shit but bitches and money i passed that weed like i studied,1
LOL such a nig,1
The Biebs is getting fucked right in the pussy,1
Smh Go play dreamcast Hate playing with someone at home on that trash ass default broadcast cam 2K camera is the goat,1
128529 and on that note Im out dis bitch,1
Niggah niggah niggah dont believe me just wacthh,1
Snapchat got hacked all of you hoes about to have some explaining to do,1
Farra from teen mom has 2 sex tapes on pornhub lmao hoe ass,1
A nicca got some crazy head last night 128513128513128588128588128588128515128522128540128541,1
I can guarantee that 9 out of 10 of yalls bitches follow me,1
faggot bitch,1
8220 This is awkward u fag wonder whos awesome tank that is 128522,1
It only be yall worthless bitches that be like that though,1
his hillbilly ass would shoot ya piers put ya right next to the buck hangin on his redneck ass wall,1
I ordered 8 chocolate chip cookies amp this bitch gave me fries smh I couldnt even take the shit back because I was gon be late for work,1
girl acting like Im staring at her bitch I just cant laugh at your joke? aint worth staring at anyways,1
This beat deserves Hennessey a bad bitch amp a bag of weed The Holy Trinity,1
Denial is a bitch youresilly,1
ahaha pussy is king,1
You ever dream about fucking a chick fuck her in real life then the pussy was better in the dream?,1
Niggas can do slope intercept form equations but cant make scrambled fuckin eggs thats a lil backwards,1
If my tweets offend you 1 stop being a sensitive pussy 2 Fuck your feelings,1
Nice pussy,1
Will your bitches do this for you ?,1
Baby I can make that pussy rain often,1
If you arent going to stick to one garbage can for recycling Im not going to give a single fuck about where Im putting my trash,1
8220 bitch ass nigga square up 128514128514,1
bitch firstly its resting on my titties and secondly if U WAS PAYING ATTENTION YOUD HAVE SEEN WHEN I SAID I ROLLED INTO IT,1
Thats your bitch why she acting like she need a man?,1
Ill fucking merk a bitch dude dont fuck with me,1
He bring the hoes out on twitter nigga got magical powers Who is ?,1
all these faggots posting faces about to get the hot unfollow,1
lmao they know who the kitty master is Dont hate bitch,1
fuck you pussy i made a mistake and started cj spiller over chris ivory this week fuck,1
Not even sweating these hoes 128524128588,1
Im just living my nig,1
8220 they cant fit on that small ass street you know what happen last time we was onyur st 128514,1
dude I was pissed but then looking at it I fucking died at least Im the most yoked,1
FACTS 8220 Your pussy not that good if 10 niggas had it but none of them are still with u8221,1
And by YALL I mean Whoever running back telling tunchi wtf Im doing thats not my nigga dog niggas nd bitches 128175,1
You a bitch,1
fuck this fat mexican bitch,1
Fuck ms Patrick that bitch cant teach for shit,1
bitch you look like a deformed version of rocky,1
Yea but who gets more bitches grandma,1
You a shoulda coulda woulda ass niggah Ima wish a niggah would ona hood ass niggah,1
Oh no she didnt 128129 8220 Watch yo mouth bitch One bitch and two dogs,1
GerrysHalloweenParty Halloween was yesterday stupid nigger,1
I heard Love Dont Love You by En Vogue at work lastnight Shit groovy as a bitch,1
Comin from a fat bitch,1
I cant be in my twenties stressing over a bitch who playin games Im straight lol,1
hahahaha youza fuck wigger,1
stop calling her a bitch crystal voice,1
607 AM Bout to match up wit dis nicca DonnyDinero,1
Im the type to put that bitch in a river so you can gtf out my lol,1
Karma is a bitch and usually comes around and goes around right? Or do some people just always catch the lucky breaks?,1
If not then you are a coward and afraid showing you have no faithJust another devils bitch,1
This bitch just blew my high 128514128514128514128514128514,1
This bitch,1
8220 Before I run from a niggah Ill lose the fight8221,1
Why would I want to play with some pussy? DEAD SNL,1
FreeballoutPartyPart3 bitch its going 3 mo weeks128588,1
These hoes out of control,1
YesWeDid start building windturbines SO FUCKIN BIG they can kill a whole flock of birds in one gogt,1
My Ralph Lauren jacket comes tomorrow Im giving out free hugs so these bitches can know what high quality fabric feels like,1
You bitch and complain about how bad our vets are being treated yet you are still willing to send them off to war? Sick idiot,1
Million dollar bitch slap a ho,1
when im there with a ghetto ass accent being shy as hell like,1
I done hit bout 6 threes out this bitch,1
When i bitch fuck my hologram doe,1
bitch no 9995128514,1
Apparently the current hair trend for Hollywood bitches is to look like you lost a fight with a weed whacker,1
Lmaoo shut up hoe,1
Fucking twat Xavi checking the grass HAHA,1
I feel like slapping a bitch,1
Pornographicoooo Dont make you no hoeoo,1
bitches will great valuable pussy always make you use protection Too many nasty dick niggas out here,1
Easy pussy doesnt motivate me,1
salon is is chuck full of butthurt liberal retards,1
Here we go this fat bitch started talking and now will never stop,1
She says i act different she thinks that its them bad bitches Naw babe its just you and the thought of you being my misses,1
We all know a bitch boy named Luke,1
You still fuckin with a sorry ass nigga that makes you a sorry ass bitch Mimi NotSorry,1
128514128514 my nig,1
I recall you telling one of the Apollo teachers you hoped her baby came out retarded and it did lol 128514,1
I hate these hoes that look thick from the front them she pass u amp her ass be missing,1
i dont shit talk i chip talk dese niggaz jus bitch talk dese niggaz jus chik stalk naw i aint got no chik,1
Its hard getting a bitch from the hood to suck your dick on cameraShe swear EVERYBODY knows herAnd she hates the light,1
text me my phone being a cunt whore,1
Happy birthday to this coon ass nigga buckcity,1
Wake up like fuck my life lifes a bitch but she better fuck me right,1
i swear u a fuck nigga u a scary little bitch u think this a game huh?,1
Me fixing my car 10000 The fade this hoe gone catch Pricless,1
My hoes they do drugzzz,1
Id break that little bitches finger,1
Its unfortunate that everyone thinks Im a bitch before they even meet me chronicbitchface sorryimscary 128539128513,1
why tf is this bitch in my class wearing all brewers shit its football season,1
Kobe Thats why yo man want me hoe guy holding his face Omgod kobeshia shut up,1
Fuckin hoe ass Click it or ticket25 dollars n shit,1
40 mins Until that bitch drop,1
When bae turns out to be a hoe,1
I need a bitch 128533,1
Statistics dont lie if you like gun control youre a queer guy FD,1
You are so fake amp Im going to put you on blast bitch,1
You dumb bitch you think I work for free,1
Truth is youre about as smelly as a barn bitch,1
Omg Dot Im sure thats not all you give away for free bitch 128128,1
your 2 And 3 Nigga them hoes suck wayans brothers are not funny at all Jamie foxx should be number 2,1
8220 one of your side chicks came up 5k8221 them bitches know where I live I be hiding from my cuz,1
I miss you being a wee cheeky cunt to me sad times missAbby,1
nigga u a cunt where yo fendi clutch,1
Bruh these hoes psychic now,1
bitch act like she never seen a face mask bitchplease,1
oh damn dis bitch found out her baby dead and now shes gonna torture the murderer lmao how fun,1
I like saying the word pussy hoe ion no why,1
These hoes dont like a nigga they love my money these niggas dont like a nigga they all want somen,1
very wrong lmao this bitch literally tried to swallow someone in this movie,1
she look like a tranny,1
I hate wen hoes lie and say I fucked em,1
You can be a good girl all you want and those hoes still gonna get us niggas from time to time,1
As soon as bitches get on a come up you got that one bitch that CANT Wait to tell ppl your downfall before the come up Haters,1
A nicca is hungry as fuk,1
Some bitches truly aint shit,1
bitch you gotta glo up one day,1
Pussy ass hoe niggas I cant fuck wit yall,1
just got done biking with my dyke,1
bitches be having reality twisted,1
Dont curve the man today in whom you may need to eat your pussy tomorrow,1
Mrs Harden be blowin me i be wanna snap on her ahhI had that bitch freshmen year damn nea caught a8230,1
The facts on tattoostattoo hes a pussy with not tattooing them nipples,1
I know when Woods Kofi and Big E were forming up RTruth was like Aint that a bitch,1
I thought you would like him cause of the Chi but yeah he a faggot,1
Light beer? You mean faggot piss? Overly Powered Man,1
After you get good pussy you be feelin like you just found the last dragon ball,1
22 not knowing wtf it is bitch,1
Chris Bosh bout to disgrace the trophy like a real faggot smh,1
i got 300 bitches like Im Sosa hoe my jewelery shinin like some mop and glo,1
Dont be a bitch,1
Cheater cheater pumpkin eater whered you find that no good white trash hoe trashy sloots,1
People always asking me what Im mixed with She a bad asian bitch lol,1
got a bitch so bad you cant afford to fuck,1
Where tf this bitch in the pink from? 128514 this hoe pointless,1
128557128557128557 Bae go text your hoes Me,1
Boy Yo bitch a lame Dont Nobody Know Her but you,1
pussy boy gone die a bitch,1
Simple minded hoe,1
8220 Nawwww If you a hoe you sittin on the floor and not my damn but your birthday is in Feb or naa?8221 Nope,1
Yall bitches dont know how to be friends 128514128514,1
Its summer bitches 128139127802127774128132128142,1
I dont hit women but Id slap tf out a bitch No close fisted business though thats some cowardly shit,1
but pussy is the root of all drama an put up in they head by they mama,1
bet nigger Im waiting for the car keys,1
This is my beach bitch,1
And fell in love with pussy he never even got,1
I wish ppl would learn how tf to stay out my business Im a grown ass man I go where I please Mind your damn business bitch,1
Hookers are always complimentarywho wants to be with a bitch?,1
I call my penis The Titanic because so many bitches went down on it,1
Treatin yo hoe like she yo bestfriend Like thats wifey,1
Annnie say fuck that niggah he soo weak 1041204 He cant tell that you a freak 1041196 That you aint lookin for love,1
Bill Romanowski is still a cunt Who saw that one coming,1
wtf u think u ole pussy ass nigga,1
8220 Searching for these hoes I got 128533 you aint the only one Bruh,1
fag,1
Dat bitch had noo cheeks,1
For all those watching that so raven Look at this negro now,1
ur a fucking half breed dog Stop acting,1
bitch fuck that blog where u be at meet up and get your round,1
8220 Hate driving in the rain 8221 you can drive deez nuts in your botch mouth hoe,1
all i ever asked for was patience patience amp pussy but mostly patience,1
Jammin these sad songs smoking squares thinking bout bitches lmfao,1
I gave my aunt my tupac greatest hits CD that bitch is lucky I love my tupac CD,1
does smdh stand for suck my dick hoe?,1
